{
  "$schema": "../profile.schema.json",
  "schema_version": 1,
  "id": "minimal",
  "summary": "Target minimal OAuth authorization server with client_credentials only.",
  "maturity": "planned",
  "modules": [
    "core-http",
    "identity-memory",
    "signing-ed25519",
    "oauth-client-credentials",
    "oauth-metadata"
  ],
  "policy": {
    "allow_cgo": false,
    "fips": "compatible",
    "allowed_licenses": [
      "Apache-2.0"
    ]
  }
}
